{
  "id": "core:archivist",
  "name": "Архивист",
  "typeId": "types:creature",
  "cost": {
    "generic": 3
  },
  "attack": 1,
  "health": 3,
  "abilities": [
    {
      "id": "arrival",
      "kind": "triggered",
      "trigger": "on_enter",
      "effects": [
        {
          "type": "draw",
          "player": {
            "context": "controller"
          },
          "amount": 1
        }
      ]
    }
  ],
  "keywords": []
}
